Rank,博主id,用户昵称,性别,粉丝数,关注数,是否大V,微博认证,个人简介,svip等级,score
1,6164052686,猫喜庆的小本本,f,1605931,2673,True,,外表慈祥内心抓狂的老母亲,1,2464
2,6276227682,liu_iiiiiirich,f,46.5万,242,True,搞笑幽默博主 超话主持人（分享欲爆棚的进超话）,欢迎来到我的QQ空间～ 想投稿的宝子们 直接投稿给我就行！ 部分投稿内容源于网络｜（侵歉删！）,3,2101
3,6365990425,大河财立方,m,403万,559,True,大河财立方官方微博,河南日报社智慧财经全媒体平台,1,2000
4,1774057271,生命时报,f,871万,331.0,True,《生命时报》社有限公司官方微博,人民日报主管，环球时报主办，一家具有国际视野的大众健康媒体。更多精彩关注微信“LT0385”。,2,909
5,3910809787,我深爱的68号少年,f,191,65,False,,在养猪,0,908
6,1314608344,新闻晨报,m,4059万,1624,True,《新闻晨报》官方微博,帮办热线：13524337940；商务合作： (021) 22895371（工作日9-17时），QQ 2549671421，微信 dodo171717；邮箱：service@zhoudao.com,3,907
7,1655444627,潇湘晨报,f,1755.2万,1624,True,《潇湘晨报》官方微博,简介：“影响湖南，湖南影响”，创刊于2001年，现为湖南发行量最多、影响力最大的纸媒。,3,906
8,1463503853,爱玩的喵喵小沫,f,1116600,1353,True,,哆啦A梦回到了未来，大雄要等他到80岁 我不要他的口袋，要和哆啦A梦做朋友，请他吃铜锣烧  小🍠 ：～大蛾🦋  (●'◡'●)私信注明来意  Base：杭州,1,762
9,1699432410,新华社,m,1.12亿,3161,True,新华社法人微博,新华社官方微博，重大新闻权威首发平台。,3,544
10,6651577358,今天看比赛了么,f,174534,1598,True,,私信可投稿～推广/冲榜合作私信  视频来源于网络有侵权请私,1,423
11,1223812162,反射弧超长星人影九,m,535453,587,True,,（小号@影九影九 ）SB和2B的简单相加= = 发脾气需要长时间CD和读条星人。 （不教骂人谢谢。给学费也不教(｡•ˇ‸ˇ•｡),1,321
12,6986794157,看完大球看小球,m,139345,1972,True,,什么都发，什么比赛都看，视频源自互联网转载，侵删,1,260
13,7227825708,摸鱼办公室,m,805.4万,210,True,搞笑幽默博主 超话粉丝大咖（摸鱼办公室超话） 微博原创视频博主,商务合作请加vx：ZGMJ_666,2,259
14,1706596590,Hai科技,m,601030,2614,True,,科技很Hai，关注Hai科技,1,244
15,1700832492,晓看世间夜赏梅,f,75355,177,True,体育博主 头条文章作者,不限圈瑞萍✍️娱乐影视🍉梅西⚽️❤️雷大众雷点，雷阿伟罗一切❗️乐见女孩昂扬，但iqjf无豁免权。以上。,0,214
16,5609184218,羊就是咩咩叫,f,82.2万,1594,True,娱乐博主,管好你自己❤️,3,209
17,5284320379,不想做梦噢,f,169,185,False,,不想骂人,0,200
18,1885454921,蓝鲸新闻,f,526.1万,2640,True,蓝鲸新闻官方微博,影响有影响力的人,2,197
19,6038922387,乔凯文,m,213万,1625,True,互联网科技博主,原ID@黑客凯文,2,190
20,7787554663,哎一古朝流,m,2.4万,983,True,动漫博主 超话创作官（动漫超话） 微博原创视频博主,,1,187
21,5851027596,是汪汪呢,f,217万,1084,True,数码博主 微博原创视频博主,,1,186
22,2107493602,楚斌top,m,3775102,2347,True,,喜欢女粉，喜欢汽车,1,179
23,7331622139,小怡说车,f,643958,461,True,,商务合作请私信,1,171
24,2792519675,后厂村长看大厂,m,371828,1345,True,,身处职场，总得了解点大厂动态。wx：okokok-74,1,167
25,5032932021,1X1X,m,177.4万,0,True,娱乐博主,想发啥就发啥,3,167
26,7755867260,财唯唯,f,39874,2666,True,,人群:低头族、久坐、不爱运动。爱好:喜欢吃各种各样的美食，架不住美食的诱惑。 曾经:五瘦六胖，一年半从175✂️到95，维持四年。目标:只瘦小肚子,1,161
27,1403078180,南风在北京,m,307240,2409,True,,中国男人，请更自信一点！,1,156
28,3141296113,Do医生,m,508.3万,285,True,2024最具影响力健康医疗大V 2023微博年度新知博主 健康博主,记录自己生活，分享个人思考；所有言论，仅代表个人观点。,2,151
29,1411163204,健康时报,f,593.8万,929.0,True,健康时报官方微博,微健康，随时随地不随意！人民日报社主管主办，中国百强报刊，更多精彩还可关注健康时报微信“JKSB2013”。,2,135
30,6569466125,CCS滋滋,f,2.6万,2683.0,True,娱乐博主 微博原创视频博主,图片视频源于网络 侵删,2,133
31,7670162388,宇宙中孤独且稀有的小星星,f,159925,3199,True,,做自己的光,1,132
32,7002084904,IKliyyy,m,55.5万,27,True,情感博主,上网来熬夜,2,121
33,6337273840,辞念with,f,103244,1949,True,,这里江辞 商务：JcForWorking,1,117
34,6084405732,咩有失棉,m,152835,1355,True,微博原创视频博主,？,0,114
35,2022252207,小白测评,m,399.3万,2184,True,小白测评工作室创始人 数码博主 微博VLOG博主 微博原创视频博主,不客观 真体验 一个工具性的科技数码频道,3,106
36,6444081045,氛围感研究员,f,13.3万,81,False,,开心的事要专心记起📝,6,101
37,6494750481,酸梨种草机,f,21.3万,97,False,,我发现的东西都好用,7,100
38,6641267980,全都值得马,f,13.1万,118,False,,,7,100
39,6659216388,爱买的小丸仔,f,42.7万,129,False,,不知名时尚博主,6,100
40,7766395630,香菜卷加工坊_gxt,f,18090,113,True,,关晓彤个人站——专注@关晓彤 相关数据，不管如何，会永远爱@关晓彤❤️,1,98
41,7753225060,慢慢自愈我,f,147046,2085,True,,晚安 天天开心  ·͜·,1,95
42,6444551595,阿楠搞笑日常,m,200939,13817,True,,分享搞笑幽默段子及趣味表情包和头像，带来快乐！部分来源网络.侵删 商务推广请私信 可投稿,1,94
43,7769326398,依山尽雨,f,185941,21,True,,我乱七八糟的生活,1,94
44,2599051311,喵喵困了-,f,10.3万,56,True,微博原创视频博主,来往不逢人 善恶都是我,2,93
45,6286643655,差评小菌,f,74.6万,131,True,美妆博主,我的奇妙生活,6,89
46,1762923331,蒲蒲super,f,2517872,1073,True,,畅销书《儿童长高补脑营养食谱》作者， 一个接地气的专家妈妈 合作➕vx：pupu0618,1,87
47,2844644700,若是微微笑,f,10589,2351,True,,昵称过于强大无法显示,1,87
48,7843070496,晚风挽余生,m,44948,3198,True,电视剧博主 微博剪辑视频博主,图片和视频源自网络侵删晚风啊 ～ 撩拨着情人心上的弦。,0,87
49,7433207980,张三同学,m,178.2万,176,True,法律博主,合作 私信,2,83
50,6587005047,孙浣妮,f,12.3万,193,True,萌宠博主,,1,83
51,7478974298,羊了个卷-见过杨洋32次版,f,1.7万,612,True,娱乐博主,素质不详，稠人婉拒 请勿对号入座 公司今天倒闭了吗,2,82
52,6458642686,井井有条大魚,f,20.7万,159,True,时尚博主,欢迎来到快乐基地✨喜欢挖掘各种好物 🔍研究变美干货 🧏🏻‍♀️肉脸是天生的不是胖！,6,81
53,6059492811,拆台CT,m,74.4万,4287,True,互联网科技博主 微博原创视频博主 头条文章作者,合作请+yilantfy，记得注明来意。,2,80
54,7799806116,大橘喵喵喵大栗,f,54499,3797,True,娱乐博主,反弹反弹反弹，攻击无效，且一亿倍反弹到你全家,0,80
55,6776097800,一个小小屁,f,17.2万,154,True,美妆博主,一个天天熬夜秃头种草博,7,80
56,1819746910,弘叔uncleHong,m,2056586,1737,True,,,0,77
57,7052975440,码了个马,f,32万,134,False,,,6,77
58,2318910945,新浪热点,m,7893.1万,1113,True,新浪热点官方微博,,2,76
59,1867099473,张洲,m,238.4万,1840,True,互联网科技博主,来来来，最温柔的博主来了,2,75
60,5739039565,养胖指南,f,2万,161,True,体育博主 超话创作官（樊星闪耀FZD超话）,人生是旷野，愿你高飞🦅,1,74
61,3253527891,Fish-inthesea,f,16621,2392,False,,感觉一切都没有变，又感觉一切都变了,1,72
62,7809335092,JaniceMan吻奶珊,f,205300,11674,True,,💛 人间理想李宁玉，人间妄想文咏珊 💜 2025最大心愿：老贵和妈宝男分手分手分手！！专心搞事业！,1,72
63,7473692775,超酥脆的油条,f,98085,223,True,微博原创视频博主,（ｖ＾＿＾）～✄╰ひ╯,0,64
64,7642340518,周末双休不犯法,f,20.1万,154,True,微博原创视频博主,,2,63
65,7752777629,阳红东,m,15.6万,1,True,投资内容创作者,私信要求加QQ，加微信群的是骗子，请勿上当,6,62
66,7264493800,MK-久遇,m,117804,1722,True,,视频源网络 侵删 合作请私信 可投稿,1,60
67,7516679696,九派新闻,m,442.6万,227,True,九派新闻官方微博,如果您有线索，请联系：jpbl@jp.jiupainews.com ，商务合作，请联系电话：18694040076,4,60
68,1725876907,张逸轩同学,m,2053269,516,True,,2022、2023、2024年最具影响力财经大V/最具基金人气大V；不知名情感博主，不会主动联系任何人；谨防受骗！！投稿可直接私信…,1,59
69,1791101941,玟玟佳,f,27357,4332,True,,会有痛苦的事 但开心和喜悦的事也会像山一样多 这就是人生 请自由地 豁达地 尽情地活下去,1,59
70,1731176574,陈枝辉律师,m,238957,1952,True,,北京京都律所高级合伙人，网络发言仅代表个人观点,0,58
71,2858270197,七百里加急递煎饼,m,254.6万,436,True,娱乐博主,国家一级东拉西扯种子选手,3,58
72,6033073678,你是唯一的姐妹儿,f,9.7万,3102,True,电视剧博主 微博原创视频博主,商务推广请私信,2,57
73,2028671027,馍兽,m,29616,587,True,,看别人的遭遇，悟自己的道理。,1,54
74,7397646384,阿苯,f,1199393,574,True,,WeChat：Amyliu031 （小红书勿扰）,1,52
75,7354263795,00开飞机,f,5.5万,363,True,coser 00开飞机 动漫博主,每天能发一万条,1,47
76,2048978227,碎碎九十三,f,195069,269,True,,,1,46
77,7872698952,红番茄日记本,f,18463,162,True,,･. ✧⁎⭑꙳ εïз ⋆⁺₊🍅⋆ ☆｡. ​​​,1,44
78,5071206030,言者先声,m,31.7万,2334,True,中国网锦绣天府融媒体中心主编 校园博主 微博剪辑视频博主,言者先声，为美好生活发声。,1,42
79,7186013403,翦瞳秋,f,27.6万,162,True,娱乐博主,单口相声表演艺术家,2,41
80,1823630913,C科技,m,2843258,4121,True,,C科技：一只安静的科技狗。关注科技与数码资讯，投稿、爆料、合作，请私信。,1,37
81,6619742346,谎兔粉弑,m,15251,1284,True,,京畿道小兔仙,1,37
82,6239219507,番茄炖了西红柿啦,f,12.8万,2657.0,True,美食博主 超话粉丝钻咖（美食超话）,内容来源网络，侵删,2,37
83,1612642012,不见不贱666,m,92.4万,781,True,颜值博主 微博原创视频博主,是非只在时势，公道不在人心,2,37
84,5291824241,橘子娱乐,f,9582039,1913,True,,传播娱乐正能量！（所有独家和现场拍摄内容禁止截掉水印)广告合作邮箱：ad@happyjuzi.com,1,36
85,7558234208,可爱多赵蜀黍,m,336659,666,True,,跨越山海，终见曙光,1,36
86,7773204980,饱饱还没吃饱,f,61562,5513,True,,勇敢的人先享受世界,1,36
87,5862006754,内娱日记,m,132913,3766,True,游戏博主,别太把自己当回事 谁care你,0,35
88,7868576207,奈芙er,f,529235,102,True,,励志当个有趣的super woman！ 商务合作+🛰fifiyo_7（需标注来意💕）,1,34
89,1721284411,蜂鸟摄影君,f,1018958,1010,True,,数码、摄影博主 商务合作：fnvxfnvx,1,32
90,1887312183,种斌Marco,m,745610,988,True,,一个浪迹在互联网圈子的散装文化人,1,32
91,2032139271,央证公开课,m,3700.7万,547,True,央证公开课官方微博,商务合作VX：yzgkk02,2,32
92,6168519077,榴莲吃不饱饱,f,33.9万,41,True,美食博主,买买买小能手，梦想是开一家啥都有卖的小卖部,7,32
93,6587717377,张佳ZHJ,m,944045,988,True,,游戏前路探索者！多坑游戏Gamer聚集地～,1,31
94,6997556479,吻骨以誓,m,12567,1108,True,,Love is cosmic,1,31
95,2140296057,ABC官方微博,f,831896,106,True,,更多ABC详情，欢迎登陆ABC个人护理官方网站：www.abc-love.com,0,29
96,2275284204,少年伯爵,m,1074840,882,True,,In the noisy confusion of life keep peace with your soul.,1,29
97,5388069019,爱健身的硬哥,m,152367,485,True,,爱健身，爱美食，爱旅行，爱交友。。专业健身教练，拿了几个健美冠军，有点小成绩！,1,29
98,7567651111,石海不吃猪食,f,1.6万,3607,True,微博剪辑视频博主 娱乐博主,@陈星旭--CHEN先生 至上 肖稚宇铁粉,1,29
99,5132656758,江湖李傅相,m,62.9万,4,True,微博原创视频博主 情感博主,+V：lifuxiang8335,2,29
100,5488211312,爱唱歌的小7,f,86.2万,8189,True,微博原创视频博主 微博VLOG博主 时尚博主 超话主持人（小鱼凌晨电台Vlog超话）,一个唱歌还不错的普通女孩，周杰伦的歌优先，想要听的歌置顶评论区，看到就会翻唱一下，dy：爱唱歌的小7  ，我是小7（推广合作私信）,2,28
101,7631232687,今天我贼拉开心,f,1.8万,1577,True,超话粉丝钻咖（邓为超话） 微博剪辑视频博主,雨停雨落终有时,1,28
102,5290777427,戏精庆帝,m,14.7万,436,True,电视剧博主,看走势博主，偶尔客串🍉主，果农～,2,28
103,2533837991,当然有戏__,m,305433,849,True,,人生就是一场戏，你在台上演戏，我在台下看戏。人生如戏，戏如人生，人生当然有戏！,1,27
104,3991770291,潘明先生,m,3826924,969,True,,言论仅为个人观点，与供职单位无关。,1,25
105,5644557960,亓祐-见过Eason版,f,188137,2105,True,,只想为好事泪流  🈴️➕Easonfnds071备注来意,1,23
106,6777372092,清酌月下酒,f,81071,602,True,,不熟别问稿价//朋友外不推画师//直fo不回//国家职业级画饼选手//木苏里，墙头激推//我讨厌立体gay//,1,23
107,7548920421,momo粒_,f,1407876,209,True,,momo也想玩手机 搞笑女勇闯机圈,1,23
108,3279710155,斯图卡98,m,5861538,1956,True,互联网科技博主 视频博主,社会，资讯，历史,0,23
109,2172631523,江雨萌,f,1264507,1941,True,,时尚美妆博主，独立撰稿人。合作请私信联系！,1,22
110,6163871963,少荣科技君,f,312704,1113,True,,这是一个有趣的博主 商务合作请联系 QQ：1040665874  VX：Summeryu26（备注来意谢谢）,1,22
111,6354372953,宁艺灼灼其华_,f,5747,1036,True,,是一个温良的人 宁艺卓/jisung/ wonyoung 安利/战斗/👄队友 现在🈷️人 ch等级或者有花钱记录的秒回关 以防万一🈷️到粉籍不清楚的人！！！,1,22
112,5715111156,江苏大卫财经,m,1489,141,False,,这短短的一生，我们最终都会失去，你不如大胆一些做你想做的。,0,21
113,7524204707,小猫随身听-守护闪不亮版,m,2253,243,True,,想要征服的世界 始终都没有改变,1,21
114,7010131150,帝吧官微,f,158.3万,975,True,超话主持人（帝吧超话）,海外帝吧官方微博,2,21
115,1720462964,兰州新世相,m,1011153,2124,True,,投稿，信息咨询，合作事宜请私信。,1,20
116,3514817904,绵卷卷,f,347168,582,True,,你的电子闺蜜💖👭🏻 // 🍠：卷崽好甜//    🛰️可以来找我聊天：mianjuanjuan,1,20
117,6816075606,杨瀚微博,m,7.3万,689,True,退役军人、中国小动物保护协会 志愿者 军事博主 微博原创视频博主,人多的时候别看我小店哦，相当炸裂,2,20
118,6155599607,醉仙美6,f,23.3万,51,True,超话主持人（醉仙美6超话）,欢迎投稿明星和网红,2,20
119,6282596127,九号秘事局,f,24.7万,79.0,True,星座命理博主,微信公众号：jiuhaomishiju 小助理号：jiuhaohuangli,8,20
120,3665229601,企鹅妹妹22,f,43,122,False,,我喜欢她，她喜欢一米八。,0,20
121,7717887199,木木很瘦丫,m,286687,687,True,娱乐博主,网络就是玩，交朋友,0,20
122,7396956580,南有菩提,f,17.9万,592,True,读物博主,关注后立马取关、快转文章的一律拉黑🗄  老福特：南有菩提   不要私信求car❗ ❗ ❗/镇魂,2,20
123,1887344341,观察者网,m,2007.4万,1318,True,观察者网(www.guancha.cn)官方微博,关注我们,3,19
124,2705169595,正能量彔,f,105.1万,363,True,教育博主,“以微博之力，让世界更美”。声明:微博有原创有搬运，侵权请私信我删除。,2,18
125,3170072514,撩汉机小魔女,m,56707,1780,True,,哪吒事业粉,1,18
126,7652377360,juice粥,f,98468,1913,True,,欢迎你来认识我。,1,18
127,1301904252,江苏新闻,m,511.1万,1535,True,江苏广电总台融媒体新闻中心,江苏广电总台融媒体新闻中心、江苏公共·新闻频道，旗下《江苏新时空》《新闻眼》《新闻360》《通天下》《评新而论》《早安江苏》《网罗天下》等栏目,1,18
128,6165797992,任嘉小雪儿,f,3.2万,2209,True,娱乐博主 微博剪辑视频博主,切勿直关，目前养耗，暂停互粉。 ｜ iMelodyDesigns｜2020年6月看了《锦衣之下》粉上任嘉伦｜,1,18
129,2286092114,中国蓝新闻,m,741.9万,5946,True,浙江广电集团融媒体新闻中心中国蓝新闻官方微博,和你一起 与时代同频,3,18
130,6893440069,吃成大饼脸,f,20390,5443,True,,希望明天会有意想不到的惊喜！,1,17
131,2799368122,总裁视野,m,1568765,914,True,,“以微博之力，让世界更美” QQ：916658341,1,16
132,3051949107,兰州微导航,m,1025050,1086,True,,兰州微导航，微博区域MCN机构，为您导航兰州新闻、兰州吃喝玩乐、兰州生活、兰州旅游等本地资讯。投稿、爆料、微博合作、本地商业合作请私信。,1,16
133,2661992301,买家张俊,m,164.2万,1348,True,互联网科技博主 微博VLOG博主 微博原创视频博主 头条文章作者,科技、互联网、数码、汽车行业动态及热点分析，商务合作请私信,2,16
134,2268685365,曹勇琦,m,306.4万,918,True,互联网科技博主 微博原创视频博主 超话主持人（微博热门超话）,以铜为镜，可正衣冠；以古为镜，可知兴替；以人为镜，可明得失。,2,16
135,5722825507,最新潮生活,f,254286,372,False,,呈现最新生活热门话题榜，汇聚最近生活热点话题，国内外的生活热门新鲜事一网打尽。,0,16
136,5508960754,糖醋小鱼干_neko,f,540797,111,True,,恶龙摇了摇尾巴,1,15
137,1893892941,北京日报,m,11019157,1814,True,,爱北京，知北京；报道北京，服务读者。,1,14
138,2720608820,爱上萌熊猫,f,178203,1354,True,,大熊猫萌宠搞笑幽默分享，欢迎大家投稿,1,14
139,3485610240,瘦司七格格,f,990,245,False,,更好的成为自己。,1,14
140,5547393597,蕗過铥了奶瓶,f,2248,858,True,,abo🥰🥰陈星旭唯粉😘😘只互眼熟的宝子！,1,14
141,1365841235,独善一行,m,160.7万,269,True,青年作家 心理咨询师  微博新知博主 教育博主 微博原创视频博主,不矫情偶尔煽情的理性派知书少年。,2,14
142,5261353236,白小告呢,f,86,179,False,,,0,14
143,6504011400,心软耶,m,179472,1040,True,,普普通通的一位查性恋微博用户；微博平台非常好我会推荐给其他人使用,1,13
144,6747471065,诗经_小哑,f,69193,412,False,,小⭕ 不懂/不喜勿入 大部分粉见 小部分好友见 合作推广请私信 注意私信只能看到最后一条,0,13
145,7837816524,-哗然-,f,2115,647,True,,常华森全肯定☺︎ 网络冲浪，请勿上升,1,13
146,3335273760,爱右爱,m,5.8万,7806,True,情感博主,你的灵魂伴侣。                                图片视频来源网络侵删。不谈政治/不论是非。,1,13
147,1959185150,总裁精粹,m,166.3万,366,True,职场博主 超话主持人（总裁超话）,在这里寻找片刻的安静。   联系 QQ：916658341  声明:微博有原创有搬运，侵权请私信我删除。,2,12
148,5797057768,诗卓卓丫,f,91618,2255,True,,谢谢关注😘,1,12
149,7055357333,你的皮炎有点辣,m,32065,2217,True,,一个备战中孝的gay｜这里没你想看的,1,12
150,5180971082,狒狒的烦恼之路,m,18.3万,503,True,微博原创视频博主,本微博所有资料都来源于网络，有侵权联系删除,6,12
151,2957820881,万像视频,m,1330.8万,667,False,,万像视频，包罗万象！服务社会读者，报道生活新鲜事儿，商务合作：SSbdyezi,7,12
152,1149956613,张慧林,m,2604084,5647,True,,南京市纪委廉政观察员  江苏省科普志愿者  微博自媒体作者,1,11
153,1933903170,花糕员外,f,397884,947,True,,饮食•风俗•掌故,1,11
154,6471269693,莓有番心柿--,f,12,249,False,,我有很多废话要讲🥖•͈̑ ᴥ •͈̑🌭️ᐝ,0,11
155,6811672042,夜尘锋刃,m,2266919,1175,True,,国之大者 为国为民 商务合作:asdyanghan110,1,11
156,3963985063,黎蒙lm,m,27.5万,2428,True,搞笑幽默博主 微博原创视频博主,能有有什么烦恼？可以私信给我,8,11
157,5148153495,保罗车闻Cars01,m,439.5万,369,True,汽车资讯博主,Cars01 豪华车平台🏎 专注豪华车品牌，性能车型，Hypercar，超跑Supercar，相关改装产品及活动！,2,11
158,3551109611,旅行厨男,m,307.4万,776,True,微博旅游出行账号 旅游博主 微博原创视频博主,旅行撰稿人，环球摄影师，航拍玩家，户外骑行爱好者，汽车数码手机测评，收藏纪录片，旅游攻略分享！爱旅行的一只厨男。🛫🇨🇳🚵,3,11
159,1750852843,PChome,m,126.4万,1018,True,PChome.net电脑之家官方账号,PChome.net电脑之家官方账号，每天为您带来最精彩的全行业资讯、消费类电子产品评测以及热点事件报道。,6,11
160,1800397245,胡杨说,m,1286874,568,True,,我们的围观，或许可以解决很多问题,1,10
161,2576278033,皮肤科杨希川教授,m,2007527,1625,True,,博士，主任医师，教授。93年从事皮肤科工作，擅长脱发、痤疮、皮炎湿疹、荨麻疹、色斑及疑难少见病。,1,10
162,3304893401,春城老哥,m,393351,1196,True,,弘扬正能量，人还是要有梦想的，万一实现了呢？,1,10
163,5380501825,昌江发布,m,160632,10841,True,,关注民生，关心民意，贴心服务,1,10
164,5859146945,ATAO颜值上分中,f,155568,934,True,,我想当业余爱好中的专业人士💗,0,10
165,5872517953,我猜你一定读了我的ID,f,54,141,False,,,0,10
166,5985166710,嗨兰州,m,271989,305,True,,嗨吃，嗨玩，嗨兰州，兰州生活嗨起来！专注于兰州美食、旅游.关注嗨兰州，兰州吃玩不错过。合作V❤：598282339 微博区域MCN机构,1,10
167,6703158402,半夏微凉neo,f,1.2万,748,True,超话粉丝大咖（侯明昊超话） 微博剪辑视频博主,侯明昊唯粉，🈲快转 🈲单曲，单曲拉嘿！可sx茴关,1,10
168,7158419171,恰逢拾伍_Violet,f,11268,422,True,,在浪费时间中找到乐趣就不算浪费时间,1,10
169,7813929958,弦雨迟,f,27205,1553,True,,进击的巨人中的无垢巨人由李泽言白起周棋洛扮演,1,10
170,2431328567,微博热点,f,314.2万,2444,True,微博内容中心官方微博,微博内容中心官方微博,7,10
171,7480824636,凰家实验室,f,1271120,460,True,凤凰网凰家实验室官方微博,用硬核态度，做有料评测。进粉丝群加：hjpc2020 合作邮箱：pcbyy@ifeng.com,7,10
172,1837242684,金华小陈说事,m,278653,1194,True,,23C全网最接地气的酱油博主（金华）有好的故事！文明以及不文明现象可以分享（反馈）给我！,1,9
173,1870299693,毛发浓密大赛冠军,f,142061,789,True,,话像头发一样多。,1,9
174,7800807818,电竞系学长,m,588785,11974,True,,合作或侵权请私信联系,1,9
175,1457478803,脊梁in上海SH,m,132.8万,3114,True,本地新势力博主 人文艺术博主 微博原创视频博主,20年媒体从业，上海城市考古运营者，上海本地气象博主。纪录上海，热爱上海,2,9
176,1080814012,托帕兹,f,343924,504,True,,一个私人号！私人号！私人号！ 发表的一切内容仅代表个人观点。Solo追星，不约人。,1,8
177,5993423827,怪博士李雷,m,1688830,1196,True,,生物学博士,1,8
178,5944114131,酩酊沉酣,f,3.7万,225,1,超话主持人（魔道祖师超话） 微博原创视频博主,蓝忘机&amp;魏无羡,1,8
179,1682207150,南方日报,m,1671.6万,259.0,True,南方日报官方微博,华南主流政经大报，秉承“高度决定影响力”的办报理念；旗下南方+客户端是广东传播主平台、湾区第一端。,2,8
180,6393166009,邓学平律师,m,78.1万,836,True,律师 法律博主,上海权典律师事务所主任,1,8
181,7455677482,箴言_胡,f,8578,5426,True,美食博主,"💋～你陪我一程,我念你一生 ～ 💋 🌷《你若懂我，一切尽在不言中》🌷",6,8
182,7166585564,生活每天都进步一点,f,1.6万,138.0,False,,美好生活，从小小的进步开始,6,8
183,3736142854,羊麦麦咩,f,2970,407,False,,浪漫的365天,0,7
184,5173239667,兰州新城事,f,487528,1737,True,,兰州微传媒，微博MCN机构成员，本地新闻、吃喝玩乐、旅游等资讯。投稿、爆料请私信小编。微博合作、本地商业合作私信留下联系方式！,1,7
185,5317526150,瞬颜一,m,11892,624,True,,我爱玩游戏,1,7
186,5386149032,-MacaBaka,f,49359,713,True,,听说快乐会传染,1,7
187,5684017110,尖峰辉哥,m,90120,10043,True,,自由是生命的灵魂！,1,7
188,5849859085,耗子头主任,f,42530,8,True,,撰写女人自己的史诗。‖ 周末不上线,1,7
189,6026921854,萤火虫在线,m,205693,20000,True,,只言片语，总有一分是你喜欢的,1,7
190,6293199312,精神病人电波站,f,590,1086,False,,醒来总比睡着好,0,7
191,7210074173,你麻薯叻,m,20584,1861,True,,在你的隻字片語裡找到勇氣,1,7
192,7486367270,小锅舒芙蕾,f,13208,2515,True,,不是gay,1,7
193,6249379680,礼哥,f,146.9万,751,True,游戏博主 微博原创视频博主,想知道游戏新资讯，跟着礼哥走,2,7
194,1700162184,李小萌,f,10983547,1287,True,媒体人,家庭教育 13911806665,0,7
195,5691358782,就叫黄小凡,f,63.3万,511,True,数码博主 微博VLOG博主,合作请加UPLAB0401,1,7
